999630;Quang Nam Viet Co Ltd;4;;;www.quangnamviet.com.vn;www.abb.com;43/529 Da Tuong Street, Ward 10, District 8;700000;Ho Chi Minh City;TP. Ho Chi Minh;Viet Nam;
999717;Song Nhat Service Trading Co Ltd;4;;;songnhat.com.vn;www.abb.com;No. 80, Street 1, Cityland (Park Hill), Ward 10, Go Vap District;700000;Ho Chi Minh;TP. Ho Chi Minh;Viet Nam;
999787;Vietnam Control & Instrumentation Service JSC;4;;;www.vietcis.com.vn/;www.abb.com;No. 27 alley 85 Duc Dien street - Phuc Dien ward - Bac Tu Liem district;100000;Ha Noi;Ha Noi;Viet Nam;
999966;Dat Vinh Tien Co Ltd;4;;;www.datvinhtien.vn;www.abb.com;35 Tran Van Danh St., W. 13, Tan Binh Dist.;700000;Thanh pho Ho Chi Minh;TP. Ho Chi Minh;Viet Nam;
1000014;EDH Power Solution Joint Stock Company;4;;;www.edh.com.vn;www.abb.com;Lot 2, CN3, Ngoc Hoi Industrial Area, Ngoc Hoi Commune, Thanh Tri District;100000;Ha Noi;Ha Noi;Viet Nam;
1000693;Cong ty Co Phan Cong Nghe va Giai Phap S5T Viet Nam;4;;;www.s5t.com.vn;www.abb.com;Phong 404 B4, tap the Thanh Xuan Bac, Phuong Thanh Xuan Bac;109990;Hanoi;Ha Noi;Viet Nam;
1000694;Cong ty co phan cong nghiep LME;4;;;lme.com.vn/;www.abb.com;Thi Tran Quang Minh, Xa Quang Minh, Huyen Me Linh;100000;Hanoi;Ha Noi;Viet Nam;
