Customer number;Customer name;Customer type;Number;E-mail;Address;Remark;Address row 1;Zip code;City/Province;State/Region;Country;
999594;Alfatronic Automacao Ltda;4;+555429921350;vendas@alfatronic.com.br;www.alfatronic.com.br;www.abb.com;Av Ruben Bento Alves, 5247;95032-440;Caxias Do Sul;Rio Grande do Sul;Brazil;
999813;3Lr Produtos E Servicos Eletricos Eireli;4;+551146515584;contato@3lr.com.br;www.3lr.com.br;www.abb.com;Rua Santa Cecilia 722;07411-190;Aruja;Sao Paulo;Brazil;
999854;APE BAURU;4;+551432276356;vendas@apebauru.com.br;www.apebauru.com.br;www.abb.com;Rua Francisco Scarcella, 4-37 - Parque Hipodromo;17033-852;Bauru;Sao Paulo;Brazil;
999873;ASSISTE EQUIPAMENTOS E ACESSORIOS INDUSTRIAIS Ltda ME;4;+553433132443;assiste@assiste.ind.br;www.lojavirtualassiste.ind.br;www.abb.com;RUA MILITINO JOSE PINTO 505;38035-340;Uberaba;Minas Gerais;Brazil;
999902;Brastech Comercio E Engenharia Ltda;4;+553434110100;;;www.abb.com;Av Alexandrita 1560;38280-000;Iturama;Minas Gerais;Brazil;
999917;CARDAO COMERCIO E IMPORTACAO LTDA;4;+552126756475;cardaorio@cardaorio.com.br;www.cardaorio.com.br;www.abb.com;RUA SIMAO DIAS SN QD 69 LT 1037 REM LTS 1037 A 1050 RUA COITE 80 LOTE DE TERRENO 1037 QUADRA 69;25251-000;DUQUE DE CAXIAS;Rio de Janeiro;Brazil;
999922;Centelha Equipamentos Eletricos Ltda;4;+551934467400;;www.dimensional.com.br;www.abb.com;Rod Engenheiro Rene Benedito Si 977;29164-043;Serra;Espirito Santo;Brazil;
999931;Combase Coml Ltda;4;+551925155480;combase@combase.com.br;www.combase.com.br;www.abb.com;Avenida Monsenhor Jeronimo Baggio,311;13075-350;Campinas;Sao Paulo;Brazil;
999933;COMERCIAL DE MATERIAIS ELETRICOS NORTE LTDA;4;+553137793627;contato@eletricanorte.com.br;www.eletricanorte.com.br;www.abb.com;R SANTA HELENA 60;35700-285;Sete Lagoas;Minas Gerais;Brazil;
999937;COMERCIAL ELETRO FONTE LTDA;4;+553433260800;lojavirtual@eletrofonte.com.br;www.eletrofonte.com.br;www.abb.com;AV BARAO DO RIO BRANCO 1726;38020-300;Uberaba;Minas Gerais;Brazil;
999944;Confase Comercial Exportadora;4;+554535723939;enerluz@enerluz.com.br;www.enerluz.com.br;www.abb.com;Rua Santos Dumont 1634;85851-040;Foz do Iguacu;Parana;Brazil;
999961;D Maestri Comercio Atacadista Ltda;4;+552737233807;;;www.abb.com;R Antonio Perutti 10;29704-670;Colatina;Espirito Santo;Brazil;
999964;Dalbem Materiais Eletricos Hidraulicos Ferragens e Ferramentas Eireli;4;+551938339000;vendas@eletrodalbem.com.br;www.eletrodalbem.com.br;www.abb.com;R Dom Paulo de Tarso Campos 141;13140-492;Paulinia;Sao Paulo;Brazil;
1000003;DISTRIBUIDORA ROBERTO J.COUTO LTDA;4;+553732214977;;;www.abb.com;R ANTONIO MARTINS GUIMARAES 1601;35502-285;Divinopolis;Minas Gerais;Brazil;
1000007;DME Distribuidora de Material Eletrico Ltda;4;+552733488100;dmeletrico@dmeletrico.com.br;www.dmeletrico.com.br;www.abb.com;R Xf Chacara 296;29164-064;Serra;Espirito Santo;Brazil;
1000093;Eletromil Comercial Ltda;4;+552733571000;vendas@eletromil.com.br;www.eletromil.com.br;www.abb.com;Av. Leitao da Silva 1397;29046-005;Vitoria;Espirito Santo;Brazil;
1000094;Eletrovan Material Eletrico Ltda.;4;+552733980050;vendas@eletrovan.com.br;www.eletrovan.com.br;www.abb.com;Rod Br 101 2698;29161-793;Serra;Espirito Santo;Brazil;
1000108;Empresa Brasileira de Montagens Ltda;4;+551136191600;atendimento@pjneblina.com.br;www.pjneblina.com.br;www.abb.com;RUA FREDERICO WOLF 258;05304-000;Sao Paulo;Sao Paulo;Brazil;
1000116;APS Componentes Eletricos Ltda;4;+551156450800;aps@apscomponentes.com.br;www.apscomponentes.com.br;www.abb.com;Trinta de Outubro 65;04776-050;Sao Paulo;Sao Paulo;Brazil;
1000289;Joclamar Ltda;4; +554721026655;joclamar@joclamar.com.br;www.joclamar.com.br;www.abb.com;R Dr Pedro Zimmermann 3210;89068-000;Blumenau;Santa Catarina;Brazil;
1000318;Loja Eletrica Ltda;4;+553140402882;vendas@lojaeletrica.com.br;www.lojaeletrica.com.br;www.abb.com;Rua Professor Jose Vieira De Mendonca 11;31310-260;Belo Horizonte;Minas Gerais;Brazil;
1000376;Multi Drive Comercio Eletroeletronico Ltda EPP;4;+551938389800;vendas@multidrive.com.br;www.multidrive.com.br;www.abb.com;Rua Serra Negra, 1186;13178-420;Sumare;Sao Paulo;Brazil;
1000385;Nortel Suprimentos Industriais SA;4;+551921027700;;www.nortel.com.br;www.abb.com;R Doutor Gustavo Or 6465, Galpao1;13052-501;Campinas;Sao Paulo;Brazil;
1000416;PLENOBRAS DISTRIB ELETRICA E HIDRAU Ltda;4;+555121016800;plenobras@plenobras.com.br;www.plenobras.com.br;www.abb.com;R. Voluntarios da Patria, 2035 - Floresta;90230-011;Porto Alegre;Rio Grande do Sul;Brazil;
1000436;Projelmig Eletrica Ltda;4;+553332218811;vendas@projelmig.com.br;www.projelmig.com.br;www.abb.com;Av. Sete De Setembro 3465;35010-173;Governador Valadares;Minas Gerais;Brazil;
1000437;Promins Industria e Engenharia Eletrica Ltda;4;+55(14)3366-2940;;promins.com.br;www.abb.com;RUA JOAO BAPTISTA GARCIA FILH 3-43;17053-460;Bauru;Sao Paulo;Brazil;
1000448;Rafael Ramão Materiais Eletricos;4;+555135973229;rhmateriaiseletricos@rhmateriaiseletricos.com.br;www.rhmateriaiseletricos.com.br;www.abb.com;Av. Bibiano Trott 381 - Genuino Sampaio;93700-000;Campo Bom;Rio Grande do Sul;Brazil;
1000520;Ribeiro Ind E Com De Prod Eletricos Ltda;4;+554130141800;;www.ribeiro.ind.br;www.abb.com;Rua Gabriel Freceiro De Mirand 1033;81810-480;Curitiba;Parana;Brazil;
1000533;Safety Control Automacao Industrial Ltda;4;+554132420316;vendas@safetycontrol.ind.br;www.safetycontrol.ind.br;www.abb.com;Rua Av Presidente Wenceslau Braz, no 2683;81010-000;Curitiba;Parana;Brazil;
1000539;Select Comercio de Materiais Eletricos Ltda;4;+555135511700;selet@selet-rs.com.br;www.selet-rs.com.br;www.abb.com;Rua Joaquim Nabuco 1516;93310-002;Novo Hamburgo;Rio Grande do Sul;Brazil;
1000622;TESLA SOLUCOES EM ELETRICIDADE Ltda;4;+554933309100;vendas@teslacomercial.com.br;www.teslacomercial.com.br;www.abb.com;RUA PAULO MARQUES, 153-D;89803-001;Chapeco;Santa Catarina;Brazil;
1000640;UNIVERSO ELETRICO LTDA;4;+553121161276;orcamentos@universoeletrico.com.br;www.universoeletrico.com.br;www.abb.com;R OTAVIANO FABRI 220;31250-682;Belo Horizonte;Minas Gerais;Brazil;
1000655;WL ATACADISTA Ltda;4;+556133615500;vendas01@atacadista.com.br;;www.abb.com;ST SCIA QUADRA 12 CONJUNTO 1 S/N LOTE 01;71250-410;Brasilia;Distrito Federal;Brazil;
1001066;Legrand Group - Headquarter;4;;;www.legrand.com.br;www.legrand.com;Rua Verbo Divino,1207 – Bloco A – Cj. 1, 2 ,11 e 12 - Chácara Santo Antônio 04719-002 São Paulo – SP Brésil;;;;brazil;
1001067;Bticino;4;;;www.bticino.com.br;www.legrand.com;Rua Verbo Divino,1207 – Bloco A – Cj. 1, 2 ,11 e 12 - Chácara Santo Antônio 04719-002 São Paulo – SP Brésil;;;;brazil;
1001068;Cemar Legrand;4;;;www.legrand.com.br;www.legrand.com;Rua Gerson Andreis, 1255 Bairro - Distrito Industrial - CEP 95112-13 Caxias do Sul - RS Brésil;;;;brazil;
1001069;HDL;4;;;www.hdl.com.br;www.legrand.com;Rodovia Waldomiro Corrêa de Camargo, Km. 52,5 13308_904 Itu - SP Brésil;;;;brazil;
1001070;Lorenzetti;4;;;www.lorenzetti-eletric.com.br;www.legrand.com;Rua João Stukas, 3312 - Jardim São Vicente 83602-110 Campo Largo – PR Brésil;;;;brazil;
1001071;PIAL Legrand;4;;;www.legrand.com.br;www.legrand.com;Rua Verbo Divino,1207 – Bloco A – Cj. 1, 2 ,11 e 12 - Chácara Santo Antônio 04719-002 São Paulo – SP Brésil;;;;brazil;
1001072;SMS;4;;;www.sms.com.br;www.legrand.com;Av Pirâmide, 661 - Jardim Eldorado - Diadema São Paulo Brésil;;;;brazil;
