Customer number;Customer name;Customer type;Number;E-mail;Address;Remark;Address row 1;Zip code;City/Province;State/Region;Country;
999920;Celasa Ingenieria y Equipos, SA;4;+50222707777;;www.celasa.com.gt;www.abb.com;Avenida Petapa 40-19 zona 12;01010;Ciudad De Guatemala;Guatemala;Guatemala;
1000170;ERNESTO ANTILLON;4;+50223260202;info@antillon.com.gt;www.antillon.com.gt;www.abb.com;14-12, 6A Avenida, Zona 9;01009;Ciudad de Guatemala;Guatemala;Guatemala;
1000216;Grupo Siasa;4;+50222189393;info@gruposervielectric.com;www.gruposiasagt.com;www.abb.com;18 AV. A 0-17 Z-15 VH II;01001;Ciudad de Guatemala;Guatemala;Guatemala;
1000423;Power Solutions;4;+50222138500;info@powersolutionsgt.com;www.powersolutionsgt.com;www.abb.com;6ta. Calle 13-93, Apto. A Sector B2 San Cristobal, Zona 8 de MixcoGuatemala, Centro America;;Ciudad de Guatemala;Guatemala;Guatemala;
1000818;Grupo en Soluciones de Ingenieria y Automatizacion, S.A.;4;+50244206612;cpinto@gruposiasagt.com;www.gruposiasagt.com;www.abb.com;17 Ave. 5/61 Zona 15 V.H 1;0000;Ciudad de Guatemala;Guatemala;Guatemala;
1001084;Bticino;4;;bticino.guatemala@bticino.com;;www.legrand.com;14 Calle 3-51 Zona 10 Edificio Murano Center, Local 11, Segundo Nivel Ciudad de Guatemala Guatemala;;;;guatemala;
