Customer number;Customer name;Customer type;Number;E-mail;Address;Remark;Address row 1;Zip code;City/Province;State/Region;Country;
1017622;Shreelight Power Pvt. Ltd.;4;9376221350/9227467922;info@shreelight.com;;www.se.com;101-102, Shree Jala Apartment, Opp. Lakadi pool, Near Aurobindo Ashram, Dandia Bazar, Vadodara - 390 001;390 001;Vadodara;Gujarat;india;
1017623;Shri Balaji Enterprises;4;9822968096;balajishri4@hotmail.com;;www.se.com;Plot No. 6, Bunglow No. 18, Vikas Colony, Trimbak Road, Behind VIP Showroom,;422007;Nashik;Maharashtra;india;
1017624;Shri Chamundi Baking Equipments;4;0435-2421081;shrichamundi@yahoo.com;;www.se.com;252, Perumal Koil Street;612 401;Kumbakonam;Tamil Nadu;india;
1017625;Shri Krishna;4;9790983346;info@shrikrishna.in;;www.se.com;No: J 49/2, First Floor, Kambar Street,Thiru Nagar, Jafferkhanpet Chennai;600083;Chennai;Tamil Nadu;india;
1017627;Balaji Switch Gears Pvt. Ltd.;4;9958972456;garg.piyush@balajiswitchgears.com;;www.se.com;Plot No.70 A 13 , Rama Road, Najafgarh Road,New Delhi;110015;New Delhi;Delhi;india;
1017628;Shrinath Traders;4;02602429580;shrinath_traders@yahoo.co.in;;www.se.com;105, Hakimji Busines Centre,;396195;Vapi;Gujarat;india;
1017629;Shubham Electrical & Consultant;4;0124-4015075/9899806665;shubhamelectrical@yahoo.co.in;;www.se.com;Shop No 166, Vyapar Sadan, M.G. Road;122001;Gurgaon;Haryana;india;
1017630;Shyam Constructions;4;9870930260;shyamconstructions@yahoo.com;;www.se.com;998/2, Shastri Nagar,;250004;Meerut;Uttar Pradesh;india;
1017631;Shyam Electric World;4;02812365482;shyam.electric@yahoo.com;;www.se.com;Vivekanand Nagar, Nr. Sun Petrol Pump, Kotharia Main Road,;360002;Rajkot;Gujarat;india;
1017632;Shyam Electricals;4;05712741087;;;www.se.com;Kishanpur Tirah, Ramghat Road,;202001;Aligarh;Uttar Pradesh;india;
1017633;Siddhant Instruments;4;0755-4203100;sales@siddhantinstruments.co.in;;www.se.com;B-76, Crystal Tower, Kasturba Nagar, Bhopal;462043;Bhopal;Madhya Pradesh;india;
1017634;Simply Electrifying Pvt. Ltd.;4;9822025114;shailesh@simply-electrifying.com;;www.se.com;201 Varsha Avenue, 104 Anand Park, Aundh, Pune 411007;411007;Pune;Maharashtra;india;
1017635;SIMPLY ELECTRIFYING PVT. LTD. + A B CONTROLS;4;020-25890010/25890030;contact@simply-electrifying.com;www.simply-electrifying.com;www.se.com;# 402 Varsha Avenue;411007;Pune;Maharashtra;india;
1017636;Siva Electricals;4;0421-2201767;;;www.se.com;4, Kumaran Shopping Complex, Kumaran Road,;641601;Tiruppur;Tamil Nadu;india;
1017637;Smartek Engineering;4;777085500;amarjeet@smartekindia.net;;www.se.com;1/2, Ground Floor, House No 15,;486886;Singrauli;Madhya Pradesh;india;
1017638;Basant Enterprises & Co.;4;0755-2420543;rajeev.basant@gmail.com;;www.se.com;B-16, Pandit Dindayal Parisar, E-2 Arera Colony,;462016;Bhopal;Madhya Pradesh;india;
1017639;Sonepar India Private Limited;4;(991)006-0459;abhay.girase@soneparindia.com;;www.se.com;B7/1A, Kothari Compound, 27 Acres, Manpada, Thane West, Mumbai;400607;Mumbai;Maharashtra;india;
1017640;Sooryaoli Solar Products Private Limited;4;09244555786;sooryaolisolarvpm@gmail.com;;www.se.com;No.5, Anna Street, Ragavanpet,;605103;Villupuram;Tamil Nadu;india;
1017642;Spares 4 U;4;04522433321;rajagopal@spares4u.in;;www.se.com;No. 3/1, Olaganeri Village, Uthangudi,;625107;Madurai;Tamil Nadu;india;
1017643;Spark Enterprises;4;9216193756;sparkchandigarh@gmail.com;;www.se.com;First floor, Plot No. 923, Kapur industries Building, Industrial Area Phase-2, Chandigarh;160002;Chandigarh;Chandigarh;india;
1017644;Spectrum Business Associates;4;9728499526;saket@sbaindia.in;;www.se.com;B -12, Industrial Estate, Double Storey, Sonipat;131001;Sonipat;Haryana;india;
1017645;Spectrum Control System;4;9600989457;saravanan@spectrumcontrolsystem.com;;www.se.com;74-A, Kallar Street,;620017;Tiruchirappalli;Tamil Nadu;india;
1017646;Square 'A' Enterprises;4;040-66699344;info@squarea.in;;www.se.com;Shop No.18, Minerva Complex, S.D. Road Secunderabad;500003;Secunderabad;Telangana;india;
1017647;Square Deal Electromechanical;4;0484-4035172;contact@sqdem.com;;www.se.com;38/2422A,Kaloor-Kadavanthara Road,Opp. Kettuvallam Restaurant,Kadavanthara, Kochi;682017;Kochi;Kerala;india;
1017648;Sree Durga Agency;4;9436762031;royashish80@gmail.com;;www.se.com;Durga Bhavan, College Tila,;799004;Agartala;Tripura;india;
1017649;Bengal Electricals;4;9830699908;bengalelectricals@gmail.com;;www.se.com;8, Ganesh Chandra Avenue;700013;Kolkata;West Bengal;india;
1017650;Sree Hari Hi-Tech Automations;4;04562-277726;sreeharisvk@gmail.com;;www.se.com;28, Javulikadai Street,;626123;Sivakasi;Tamil Nadu;india;
1017652;Sri Ganesh Electronics;4;09943620306;sriganeshelectronics@yahoo.co.in;;www.se.com;1 Vittoba Street, Arcot, Vellore Dist.,;632503;Ranipet;Tamil Nadu;india;
1017653;Sri Kumar Enterprises;4;08662582927;srikumaarenterprises@gmail.com;;www.se.com;2nd Floor, Chalasani Complex, D.No.74-1-15, MG Road, Opp.Auonagar Gate;520007;Vijayawada;Andhra Pradesh;india;
1017654;Sri Murugan Wires & Cables Private Limited;4;9841048581;enquiry@murugangroups.com;;www.se.com;K-25, 9th Street, Sector-1,;600058;Chennai;Tamil Nadu;india;
1017655;Srinivasa Electricals;4;9848679406;enquiry@srinivasaelectricals.co.in;;www.se.com;D.No-14-1-14,Cinema Road, Opp. Ananda Bharati Grounds, E.G.District, Kakinada;533001;Kakinada;Andhra Pradesh;india;
1017656;Standard Sales Corporation;4;9822599584;standardsales11@gmail.com;;www.se.com;Aman Square, Shop No 1, 1281 Kasba Peth,;411011;Pune;Maharashtra;india;
1017657;Subhadra Engineering Projects;4;0891-2766767;subhadraprojects@hotmail.com;;www.se.com;47-9-5, Dwarakanagar Nagar 3rd Lane, Near Diamond Park, Behind Bez Krishna Hotel ;530016;Visakhapatnam;Andhra Pradesh;india;
1017658;Sumeet E Enterprises;4;0866-2427049,9849518125;iklik.vza@gmail.com;;www.se.com;D.No.11-31-28A, Park Road, One Town, Krishna Dist.;520001;Vijayawada;Andhra Pradesh;india;
1017659;Sunil Electric Co. (1181);4;9987767377;dhaval@sunilelectricco.com;;www.se.com;158 K.M. Sharma Marg, Lohar Chawl, P.O.2794, P.B. No.2794, Mumbai;400002;Mumbai;Maharashtra;india;
1017660;Bengal Trading Co.;4;3532777435;;;www.se.com;187, Sevok Road,;734401;Siliguri;West Bengal;india;
1017661;Sunshine Enterprises;4;9711311023;sunshineenterprises250815@gmail.com;;www.se.com;C-86, Gali No.4, Ganga Vihar,;110094;Delhi;Delhi;india;
1017662;Supreme Electrical & Switchgear;4;9810267185;anujkhandelwal08@gmail.com;;www.se.com;37Mile Stone Algha Udyog Complex, Near Ayushman Hospital, Hero Honda Chowk,;122001;Gurgaon;Haryana;india;
1017663;Surakasha Enterprises;4;02772-299904;surakshaenterprise_hmt@yahoo.com;;www.se.com;14 Sumeru Complex, Civil Circle, Opp Hotel Payal, Dist. Sabarkantha,;383001;Himatnagar;Gujarat;india;
1017664;Sushil Electricals;4;044-25362179;info@sushilelectricals.co.in;;www.se.com;No. - 104, 15A, Golden Touch Complex, Govindappa Naicken Street;600001;Chennai;Tamil Nadu;india;
1017665;SV Power Solutions;4;09676446189;svpowersolutions@gmail.com;;www.se.com;Door No. 13-3-39, Ground Floor, Kothapet, Opp. Line of RTC Bus Stand, Near Goudiyamatam,;522001;Guntur;Andhra Pradesh;india;
1017666;Swastik Electrical Industries;4;9844050506;1944sei@gmail.com;;www.se.com;54, Ground Floor, V.S.Lane, Chickpet Cross;560053;Bangalore;Karnataka;india;
1017667;Swastik Trading Agencies;4;01992-275238;ajaygupta_238@hotmail.com;;www.se.com;1st Floor Kohli Market, New Hospital Road,;182104;Udhampur;Jammu and Kashmir;india;
1017668;Swathi Engineering Services;4;0866-2478986;swathiengineering_schneider@rediffmail.com;;www.se.com;74-1-18/3, Opp.Autonagar Gate, M.G.Road, Patamata,;520010;Vijayawada;Andhra Pradesh;india;
1017670;System Controls & Switchgears;4;1145631911;system.controls@gmail.com;;www.se.com;Plot No.8 Block No.A,;110028;New Delhi;Delhi;india;
1017671;Bhagwati Electric & Company;4;09427639831;bhagwatiahmedabad@yahoo.com;;www.se.com;F-15, sambhavi complex., near nalanda school, Ghatlodia, Ahmedabad - 380061, jantanagar road;380061;Ahmedabad;Gujarat;india;
1017672;Taniya Trading House (pvt.) Ltd.;4;+8801717374095;sales@taniyatrading.com;taniyatrading.com/;www.se.com;House # 4/6, Road # 09, Block # J, Baridhara;1212;Dhaka;;india;
1017673;Techmech Electricals;4;9810748778;techmechelec@yahoo.com;;www.se.com;1540-A, Bhagirath Palace;110006;Delhi;Delhi;india;
1017674;Techmech Engineers;4;+918023383486;sakshi@techmechengineers.com;;www.se.com;No. 30, B6 3rd Main, KSSIDC Industrial Estate;560010;Bangalore;Karnataka;india;
1017675;Techmech Engineers;4;7305897706;sakshi@techmechengineers.com;;www.se.com;New No.8, Old No.Z-190, 5th Street, Z Block,áAnna Nagar,áChennai;600040;Chennai;Tamil Nadu;india;
1017676;Technocom-Aids;4;9437109860;tcarkl@yahoo.co.in;;www.se.com;Birsa Dahar Crossing Kacher Road;769012;Rourkela;Odisha;india;
1017677;Tele Switchgears;4;9825036412;prashant@teleswitchgears.com;www.teleswitchgears.com;www.se.com;D-511, Titanium City Center;380015;Ahmedabad;Gujarat;india;
1017678;The Marsden Bakubhai & Sons Pvt. Ltd.;4;9227250081;kunjan.bhatt@marsdenbakubhai.com;;www.se.com;Near Parimal Raliway Crossing Paldi;380007;Ahmedabad;Gujarat;india;
1017679;Tony Enterprises;4;4842332940;tonyenterprises@ymail.com;;www.se.com;Devis Tower Kathrikadavu JN, KK Road,Ernakulam;682017;Cochin;Kerala;india;
1017680;Total Control Solutions;4;02267257797;info@totalcontrolsolution.com;;www.se.com;D12, Jai Matadi Compound, Kalher Village, Bhiwandi, Thane,;421302;Mumbai;Maharashtra;india;
1017682;Aarcee Mittal Electricals Pvt Ltd;4;+91-11-23865247,23873698,23873690;sales@aarceemittal.com;www.aarceemittal.com;www.se.com;1801/7 G Floor Bhagirath Palace;110006;Delhi;Delhi;india;
1017683;Bhupindra Electric Company;4;0164-2237441;bhupindra.electric@gmail.com;;www.se.com;Opposite S.S.D. Girls College, Amrik Singh Road,;151001;Bathinda;Punjab;india;
1017684;Trans Electrics;4;0484-2376873;trans_electrics@hotmail.com;;www.se.com;39/919, Chittoor Road, Ernakulam South;682016;Cochin;Kerala;india;
1017685;Trans Waves Equipments Pvt Ltd;4;0484-6444215;trans_electrics@yahoo.co.in;;www.se.com;16/205B, NF Gate Road, Petta East, Thripunithura;682301;Cochin;Kerala;india;
1017686;Transpower Products India Pvt. Ltd;4;+918023026467;antony.transpower@gmail.com;;www.se.com;No.8, 1stFloor, Sirsi Road,Chamarajapet, Above Silicon Motors,;560018;Bangalore;Karnataka;india;
1017687;Tress Electricals;4;4842354224;accounts1@everestagencies.com;;www.se.com;Chidambaram Chambers,;682035;Kochi;Kerala;india;
1017688;Trinayanee Electrical Engineering;4;9435522444;the.subhashish@gmail.com;;www.se.com;Ashram Road, N. H. Road;788007;silchar;Assam;india;
1017689;U.K. Enterprise;4;0361-2730974;sapanmutd@yahoo.com;;www.se.com;Narendra Complex, 2nd Floor, S.S.Road, Lakhtokia, Above Zoom Color Laboratory, Opp-Industrial Co.Op. Bank,;781001;Guwahati;Assam;india;
1017690;Unique Electricals;4;4066908679;info@uniqueelectricals.com;;www.se.com;5-2-327/2,1st Floor,PVS Building, Traffic Police Station Lane, Hyderbasti, RP Road;500003;Secunderabad;Telangana;india;
1017691;Unique Sales;4;9431302272;uniquesalesjsr@gmail.com;;www.se.com;G-2, 8th Avenue, Smiruty Building Bistupur,;831001;Jamshedpur;Jharkhand;india;
1017692;Unique Technologies;4;1204994488;ranjit.jha@uniqutechnologies.com;;www.se.com;G-48, Sector 63, Noida;201301;NOIDA;Uttar Pradesh;india;
1017694;Bhushan Dealers Pvt. Ltd.;4;0253-2577192;bhooshandlrs@gmail.com;;www.se.com;T.A.Kulkaeni Colony Mauli, Sharanpur Croos Road;422002;Nashik;Maharashtra;india;
1017695;United Electrical & Automation Co.;4;09845025856;info@ueaa.in;;www.se.com;Door No.7C-T-73/13, Gurucharan Industries, Plot No.QG 1,2,3, C 73, Industrial Area, Baikampady,;575011;Mangalore;Karnataka;india;
1017696;Universal Automations;4;(970)537-2482;myuniversalautomations@gmail.com;;www.se.com;D.No. 1-8-42, Gujjana Gundla, Near Anjaneya Swami Temple,;522006;Guntur;Andhra Pradesh;india;
1017697;Urja Shakti Sales & Service;4;9825026773;infourja16@gmail.com;;www.se.com;706 Siddharth Complex;390007;Vadodara;Gujarat;india;
1017698;Uttam Electric Store;4;0131-2437762;uttamelectricstore@gmail.com;;www.se.com;35, Roorkee Road,;251001;Muzaffarnagar;Uttar Pradesh;india;
1017700;V.N.R. Enterprises;4;0427-2266263;subbuslm46@gmail.com;;www.se.com;87-B,  Arunachal Asari Street;636001;Salem;Tamil Nadu;india;
1017701;Vasu Associates;4;0129-4021851;vasuassociates@rediffmail.com;;www.se.com;1D/120, N.I.T.Faridabad;121001;Faridabad;Haryana;india;
1017702;Vertex Automation & Controls;4;01732-257168;vertexautomation.amit@gmail.com;;www.se.com;Plot No 75-76, Vishal Nagar,;135001;Yamuna Nagar;Haryana;india;
1017703;Vertexx Communication & Technology Private Limited;4;06742397404;vertexx.odisha@gmail.com;;www.se.com;Plot No. 64, Surya Nagar, Near OUAT Campus (Gopabandhu Square), Opposite OPOLFED Center,;751003;Bhubaneswar;Odisha;india;
1017704;Vignesh Electric Company;4;4222380601;vigneshelec@hotmail.com;;www.se.com;156, Parsn's Trade Plaza, Dr Nanjappa Road, Coimbatore;641018;Coimbatore;Tamil Nadu;india;
1017705;BHUTANI ELECTRIC STORE;4;0184-4042348;bhutanibest@gmail.com;;www.se.com;OPP. RANDHIR CINEMA, KUNJPURA RAOD;132001;KARNAL;Haryana;india;
1017706;Vinil Electricals;4;0265-6641245/6595245;vinilelectricals@hotmail.com;;www.se.com;FF1, Kailash Complex , B.P.C Road, Alkapuri;390005;Vadodara;Gujarat;india;
1017709;VPN Agenciies;4;9894036253;vpn@vpnagenciies.com;;www.se.com;322, Dr.Nanjappa Road,;641018;Coimbatore;Tamil Nadu;india;
1017710;VPN Agenciies;4;9894036253;vpncbe@gmail.com;;www.se.com;71, Hotel Silver Palace, Chinneri Vaya Kadu Road, Pallapatti PO Salem, Salem, Tamil Nadu;636009;Salem;Tamil Nadu;india;
1017711;VS Industrial Trading Co.;4;04762620608;vseleworld@gmail.com;;www.se.com;Market Road, Karungappally,;690518;Kollam;Kerala;india;
1017712;Western Electric & Trading Co.;4;011-23279142;wetco3@gmail.com;;www.se.com;358, Bulaki Begum Street, Dariba Kalan,;110006;Delhi;Delhi;india;
1017713;Winners Marketing;4;9826374540;winnersmarketing309@gmail.com;;www.se.com;309, Raja Ram Mohan Roy Complex, MTH Compound;452018;Indore;Madhya Pradesh;india;
1017714;Wire & Cable Corporation;4;0361-2542230;wccghy@gmail.com;;www.se.com;Sharif Complex, Near Railway Gate N;781001;Guwahati;Assam;india;
1017715;Yash Marketing;4;8770295100;yashmktg_tb@rediffmail.com;;www.se.com;158/159, 1st floor, LalGanga shopping Mall,G.E. Road,Raipur;492001;Raipur;chhattisgarh;india;
1017716;Bianco Pvt ltd;4;+94112507252;bianko@sitnet.lk;;www.se.com;49/1, Fife Road , Colombo05;;Colombo;;india;
1017717;Zeal Enterprise;4;0265-2975295;info@zealenterprise.in;;www.se.com;282/2/A, GIDC, MAKARPURA, BARODA - 390010;390010;Vadodara;Gujarat;india;
1017718;Zigma TradeLine;4;0487-2381378;zigmatradeline2010@gmail.com;;www.se.com;Door No.12/689/32, Mars Complex, Poothole Road,;680001;Thirssur;Kerala;india;
1017719;Zoom Electrical Agency;4;04712469035;zoomelectricals@live.com;;www.se.com;TC 30/874 (1), TC30/874 (2), Athira Tower, Pettah,;695024;Thiruvananthapuram;Kerala;india;
1017720;Bindal Pump & Electricals;4;+919234300172;bpe.dhn@gmail.com;;www.se.com;Rajhans Mansion, Bank More;826001;Dhanbad;Jharkhand;india;
1017721;Brahmaputra Industrial Corporation;4;9435081330;bic.ghy@gmail.com;;www.se.com;B-5,Mangal Ram Tower,;781001;Guwahati;Assam;india;
1017722;Brisk Electronics Pvt. Ltd.;4;9822037209;abhaysat@gmail.com;;www.se.com;319/320,Sidharth Towers, Bldg 1, G A Kulkarni Path, Kothrud, PUNE;411038;Pune;Maharashtra;india;
1017723;Brisk Electronics Pvt. Ltd.;4;9822037209;bhavik@briskelectronics.com;;www.se.com;304, Gala Argos,Near Harikrupa Tower, Kalgi Cross Road,Ellisbridge, Ahmedabad;380006;Ahmedabad;Gujarat;india;
1017724;Brisk Electronics Pvt. Ltd.;4;9822037209;salesnagpur@briskelectronics.com;;www.se.com;Plot No. D98, MIDC Hingna, Near Wadi Hingna T Point, Opp. Modigold,Nagpur;440028;Nagpur;Maharashtra;india;
1017725;Brisk Electronics Pvt. Ltd.,;4;9822037209;saleskolhapur@briskelectronics.com;;www.se.com;D-23, Kolhapur Udyam Co-Opp Society Limited, 1328/34 Y.P. Pawar Nagar, Kolhapur;416008;Kolhapur;Maharashtra;india;
1017726;AARES MARKETING;4;04652-229645;aaresmarketing@gmail.com;;www.se.com;No. 11B3/4, Nixon Pinnacle, Cruz Enclave, North Sarguna Veethi, Ramanputhur Road, Nagercoil;629001;Nagercoil;Tamil Nadu;india;
1017727;C.L. Eneterprise;4;0522-2284171;cmelect32gb@yahoo.co.in;;www.se.com;103 Ajanta Arcade, 32 GB Marg;226018;Lucknow;Uttar Pradesh;india;
1017728;Cable House;4;0291-3258924;sunil_cablehouse@rediffmail.com;;www.se.com;E(30) A, Near Bank Of Baroda, MIA IInd Phase, Basni,;342005;Jodhpur;Rajasthan;india;
1017729;CABOT SYSTEMS & AUTOMATION;4;9810033915;sales@cabotgroups.com;;www.se.com;149 Patpargang Ind Area;110092;New Delhi;Delhi;india;
1017730;Cadillac Automation & Controls;4;9744227300;info@cadillacautomation.com;www.cadillacautomation.com;www.se.com;No. 1062 - C2, 2nd Floor, Opp. Najath Public School, Changampuzha Nagar P.O., Kalamassery,;682023;Ernakulam;Kerala;india;
1017731;Central Electricals & Electronics Pvt. Ltd.;4;986755550;sales@centralelectricals.co.in;;www.se.com;47, 4th Floor, Tardeo Airconditioned Market, Mumbai Central West,;400034;Mumbai;Maharashtra;india;
1017732;Central Marketing Syndicate;4;0484-2355786;info@cmskochi.net;;www.se.com;40/5755, Srinivasa Mallan Road, M. G. Road,;682035;Kochi;Kerala;india;
1017733;Chaliyar Electrical Trading Company;4;09447423316;cetcoclt@gmail.com;;www.se.com;19/99, Near Juma Masjid, Puthiyapalam Road, East Thali,;673002;Kozhikode;Kerala;india;
1017734;Chhabra Electric Co.;4;0120-2833222;hindcables@yahoo.com;;www.se.com;54 Sihani Gate Near-Chopala Mandir,;245205;Ghaziabad;Uttar Pradesh;india;
1017735;Chirag Electronics;4;079-22136323;info@chiragelectronics.com;;www.se.com;36, Akashneem Bunglows, Opp. Nehru Foundation, Vastrapur Road;380054;Ahmedabad;Gujarat;india;
1017736;Chordia Map Electricals;4;7728892800;ashok.chordia1@gmail.com;;www.se.com;12, Vivekanand Nagar, Near Ashok -;342010;Jodhpur;Rajasthan;india;
1017737;Aaroop Engineering Services;4;0278-2428797;aesjayjeet@yahoo.co.in;;www.se.com;1, Sheshvati Complex, Opp. Pattani Plaza, Devbaug Road,;364001;Bhavnagar;Gujarat;india;
1017738;Co-Needs;4;080-26604286;coneedsblr@gmail.com;;www.se.com;No.28, Ground Floor, Bikasipura Main Road, J.C. Indl. Area,;560061;Bangalore;Karnataka;india;
1017739;Co-Needs;4;044-24661441;coneeds@gmail.com;;www.se.com;No.4/GF3, (180/GF3) Luz Church Road, TNHB Complex, Mylapore, Chennai;600004;Chennai;Tamil Nadu;india;
1017740;Cochin Cables and Power Systems Pvt. Ltd.;4;0484-6452739;cochincaps@gmail.com;;www.se.com;No- 31/2126 B, Karollil Lane,Thammanam,;680032;Cochin;Kerala;india;
1017741;Crystal Controls;4;079-26923306;crystalcontrols@gmail.com;;www.se.com;601, Elanza Vertex, B/h Armieda House,Sindhu Bhavan Road, Bodakdev, Ahmedabad;380054;Ahmedabad;Gujarat;india;
1017742;Cubic Engineers;4;9358599900;cubicengineers@gmail.com;;www.se.com;163 C, South Civil Lines,;251001;Muzaffarnagar;Uttar Pradesh;india;
1017743;D.V. Electromatic (P) Ltd.;4;0186-2231231;dvepl@yahoo.in;;www.se.com;F-003, Industrial Growth Centre,;145001;Pathankot;Punjab;india;
1017744;Db Solutions;4;9440406885/9246655203;dbsolutions_power@yahoo.co.in;;www.se.com;Plot No:12, APIIC, Industrial park, Aganampudi , Vizag;530046;Visakhapatnam;Andhra Pradesh;india;
1017745;Delta Incorporation;4;1942476548;deltainc@outlook.in;https://linktr.ee/shkhirtiza;www.se.com;Chotta Bazar, Karan Nagar, Near Kashyapa School, Srinagar;190010;Srinagar;Jammu and Kashmir;india;
1017746;Deltoncontrol & Switchgears LLP;4;09900999101;anand.delton@gmail.com;;www.se.com;Lakshmi Mansion, Shop No.2, Ground Floor, 2207/2, New Medar Oni, Beside Vitthal Temple,;580020;Hubli;Karnataka;india;
1017747;Deltoncontrol & Switchgears LLP;4;9900999101;mahesh@deltoncontrol.com;www.deltoncontrol.com;www.se.com;#43/43A 1st Main Road, Mysore Rd, New Timberyard Layout, Bengaluru, Karnataka 560026;560026;Bangalore;Karnataka;india;
1017748;AB Digital Integration Private Limited;4;011-47067285;abdigitalintegration@gmail.com;;www.se.com;354, 3rd Floor, Aggarwal City Mall;110034;New Delhiu;Delhi;india;
1017749;Devi Powers Pvt.;4;0161-2601442/2227337;info@devipowers.com;;www.se.com;63, Industrial Area-A;141003;Ludhiana;Punjab;india;
1017750;Dhanbad Electricals Pvt. Ltd.;4;033-22215621;depl9999@gmail.com;;www.se.com;54, Ezra Street, Block A/2, 1st Floor,;700001;Kolkata;West Bengal;india;
1017752;Disha Agencies;4;9814115625;sales@dishaagencies.com;;www.se.com;Plot No.453, Purv Marg, 31B, Industrial Area Phase II,;160002;Chandigarh;Chandigarh;india;
1017753;Dowell Engineers;4;09443252164;dowellengineers55@gmail.com;;www.se.com;No. 23, Zam Zam Complex, Chinthamani Bazaar,;620002;Tiruchirappalli;Tamil Nadu;india;
1017754;DURASUN ELECTRIC PROJECTS;4;9845808905;bg@durasunprojects.com;;www.se.com;No.100B, Karuvadikuppam Main Road,;605003;Puducherry;Puduchery;india;
1017755;Durga Bhai & Co;4;9810007321;durgabhai@gmail.com;;www.se.com;1801/37 NAV DURGA MARKET;110006;DELHI;Delhi;india;
1017756;Durga Bhai & Co.;4;011-23862812;durgabhaidl@gmail.com;;www.se.com;Khasra No. 474, 25 Foota Road,;110084;Delhi;Delhi;india;
1017757;Durga Electric Co.;4;0172-5090347;durgaelectric@hotmail.com;;www.se.com;SCF 50, Phase-9,;160055;Mohali;Punjab;india;
1017758;Durgapur Industrial Stores;4;9800859010;info@dgpdis.com;;www.se.com;3rd, Admin Building,OC/S -18, ADDA Complex, City Centre, Durgapur;713216;Durgapur;West Bengal;india;
1017761;Dynamic Solutions;4;09419187529;dynamicsolutions9@gmail.com;;www.se.com;Morh, Purmandal, Bari, Brahmna,;180010;Jammu;Jammu and Kashmir;india;
1017762;E Power Engineering;4;044-42128545;;;www.se.com;First Floor, 93/6, Poonamallee Road, Ekkaduthangal;600097;Chennai;Tamil Nadu;india;
1017764;Eastman Electricals;4;0361-2515756;sikarias@gmail.com;;www.se.com;M.N.Road, Panbazar, Kampur;781001;Guwahati;Assam;india;
1017765;Ebasco Marketing;4;9087009322;ebascomarketing.chennai@gmail.com;;www.se.com;No :4/6,Budhhar Colony Mani Road,;600116.;chennai;Tamil Nadu;india;
1017766;ECAPS Computers India Pvt. Ltd.;4;98422 72720;purchase@caps.in;www.caps.in;www.se.com;No. 7, Ground Floor, 2nd Cross,Rajaram Mohan Roy Extn,K.H. Road ( Double Road),Bangalore- 560027;560027;Bangalore;Karnataka;india;
1017767;ELCON Equippments Private Limited;4;09884059169;sales@elconequippments.com;;www.se.com;Old No.31, New No 75, Burkit Road, T.Nagar,;600017;Chennai;Tamil Nadu;india;
1017768;Electrical Control Systems;4;09100056770;sales.hyd@electricalcontrolsystem.com;;www.se.com;6-3-131/1/1 - 60, GF, Shop No. 1, Narsapur X Roads,;500037;Hyderabad;Telangana;india;
1017769;ELECTRICAL CONTROL SYSTEMS PVT. LTD.;4;9212796973;ashishmalik@ecspvtltd.com;www.elcetricalcontrolsystem.com;www.se.com;PLOT NO. 14, 15, SECTOR 33 , OPP. INFOCITY2 GURGAON;122003;Gurgaon;Haryana;india;
1017770;Aditya Agencies;4;08712760504;;;www.se.com;Plot No 201/4, 1-85-14, Sector 4, MVP Colony,;530017;Visakhapatnam;Andhra Pradesh;india;
1017771;Electricals Plus;4;9849004822;electricalsplus@gmail.com;;www.se.com;62 M.G.Road;500003;Secunderabad;Telangana;india;
1017772;Electro Care;4;9.15422E+11;electrocare0542@outlook.com;;www.se.com;Dasarath Katra, panchkoshi, Bhojubeer;221002;Varanasi;Uttar Pradesh;india;
1017773;Electro Care (India) Private Limited;4;9820682898;pradeep@elecare.in;;www.se.com;Unit No.243, 2nd Floor, Plot No.Gen/2/1/C (Part), Raheja District-2, Edison Building No.1, Near Prabhat Diary & Thyrocare, TTC Industrial Area,Shiravane, Juinagar (East),;400705;Navi Mumbai;Maharashtra;india;
1017774;Electro-Serv (Pvt) Ltd;4;+94115324110;sales@elektro-serv.lk;www.electro-serv.lk;www.se.com;37 Melder Place Nugegoda Sri Lanka;10250;Nugegoda;;india;
1017775;Electrolite Enterprises;4;09601270648;electroliteenterprise@gmail.com;;www.se.com;J 5, Sumel Business Park - 6, Dudheshwar Road, Near Hanumanpura - BRTS Bus Stop, Shahibaug,;380004;Ahmedabad;Gujarat;india;
1017776;Electromech Engineering Co.;4;+8801306927262;nasim_bd98@yahoo.com;;www.se.com;1st Floor, Kanta Super Market, Zero Point, Khulna - 9260;9260;Khulna;;india;
1017777;Electron Engineers;4;02836-233182;electronengg@gmail.com;;www.se.com;Plot No.427, Near Dr. Dasani Clinic, Gayatri Mandir Road, Oslo Circle, Gandhidham Kutch;370201;Kutch;Gujarat;india;
1017778;Elesun Systems Pvt. Ltd.;4;0712-2247197;systems@elesun.net;;www.se.com;1st Floor, 81, Shankar Nagar, Nagpur;440010;Nagpur;Maharashtra;india;
1017779;Energy Components;4;0361-251587;comgy@sancharnet.in;;www.se.com;A.T Road.,;781001;Guwahati;Assam;india;
1017780;Energy Engineers;4;09827673963;energyengineers@ymail.com;;www.se.com;41, Ashirwad Nagar, Harda Road, Opposite Pink Avenue,;461001;Hoshangabad;Madhya Pradesh;india;
