Customer number;Customer name;Customer type;Number;E-mail;Address;Remark;Address row 1;Zip code;City/Province;State/Region;Country;
999748;Systems Established Technology Equipment Joint Stock Company;4;+02466754466;info@systemcorp.vn;;www.abb.com;293 Tran Dang Ninh Str., Dich Vong ward, Cau Giay Dist.;010000;Ha Noi;Ha Noi;Viet Nam;
999756;TD Global Joint Stock Company;4;+82462516636;info@tdglobal.com.vn;www.tdglobal.com.vn;www.abb.com;No-14,LK02 khu dat dich vu dat o ha phuong ha cau, quan ha dong;010000;Hanoi;Ha Noi;Viet Nam;
1000125;Asia Trading and Engineering Co Ltd;4;+842432484095;nguyentronghien@asitec.com.vn;www.asitec.com.vn;www.abb.com;No.2/45 Nguyen Hong, Dong Da;100000;Ha Noi;Ha Noi;Viet Nam;
1000153;BACH VIET TECHNOLOGIES CORPORATION;4;+842854130704;sales@bavitech.com;www.bavitech.com;www.abb.com;23 Pham Thai Buong Street, Tan Phong Ward, Distrist 7;700000;Ho Chi Minh;TP. Ho Chi Minh;Viet Nam;
1000343;MEE MECHANICAL ELECTRICAL ENGINEERING Co Ltd;4;+84938848788;info@mee.com.vn;www.mee.com.vn;www.abb.com;Lo HT-E10-6-9, Duong so 19 Khu Cong Nghiep Hiep Phuoc, Xa Hiep Phuoc, Huyen Nha Be;700000;Ho Chi Minh;TP. Ho Chi Minh;Viet Nam;
1000580;STPower Joint Stock Company;4;;info@sontraco.com;sontraco.com/;www.abb.com;Lo 47, duong so 2, KCN Da Nang, phuong An Hai Bac, quan Son Tra;700000;Da Nang;Da Nang;Viet Nam;
1000695;Cong ty TNHH Tu Dong Hoa va Thiet Bi Giao Duc Dong Duong;4;+439726712;atedongduong@gmail.com;dongduongate.com.vn;www.abb.com;B34 Lo 6, KDT Dinh Cong, Phuong Dinh Cong, Quan Hoang Mai;100000;Ha Noi;Ha Noi;Viet Nam;
1000771;Emt Electrical And Mechanical Techniques Jsc;4;+84422173177;;emt.com.vn;www.abb.com;No 4/89A Lane - Ly Nam De, Hoan Kiem District;100000;Ha Noi;Ha Noi;Viet Nam;
1000919;Le Gia High Technology JSC;4;84345209233;;www.levn.vn;www.abb.com;90/2 Phan Huy Ich Street, Ward 14, Go Vap District;700000;Ho Chi Minh City;TP. Ho Chi Minh;Viet Nam;
